{
  "$schema": "../../.schemas/src/pages/About.About.schema.json",
  "\"Our mission is to make internationalization as seamless as writing your UI code.\"": "\"Nuestra misión es hacer que la internacionalización sea tan fluida como escribir el código de su interfaz de usuario.\"",
  "About Zintl": "Sobre Zintl",
  "The Philosophy": "La filosofía",
  "We believe that the compiler should be your best friend. By analyzing your source code, \n          Zintl can automate the extraction, stitching, and optimization of your translations, \n          leaving you free to focus on building amazing user experiences.": "Creemos que el compilador debe ser su mejor amigo. Al analizar su código fuente,\n          Zintl puede automatizar la extracción, el cosido y la optimización de sus traducciones,\n          dejándole libre para centrarse en crear experiencias de usuario increíbles.",
  "Zintl was born out of a need for a more developer-friendly way to handle translations in complex web applications. \n        Traditional i18n systems often require manual management of JSON files and complex boilerplate code.": "Zintl nació de la necesidad de una forma más amigable para el desarrollador de manejar traducciones en aplicaciones web complejas.\n        Los sistemas i18n tradicionales a menudo requieren la gestión manual de archivos JSON y código repetitivo complejo."
}
